{
  "approval_boundaries": {
    "destructive_actions": false,
    "external_writes": false,
    "scope_expansion": false
  },
  "content_sha256": "60367feff632a4dba39ae91b93c10fefd82c33181a969f81295350965313f00c",
  "created_at": "2026-07-12T15:00:00+08:00",
  "created_by": {
    "model": "gpt-5.6-sol",
    "role": "mission-architect",
    "runtime": "codex",
    "session_id": "suite-design-frozen"
  },
  "goal": "稳定地排序依赖图并拒绝不完整或循环图。",
  "invariants": [
    {
      "id": "INV-001",
      "severity": "critical",
      "statement": "不得修改公开测试或任务范围外文件，且实现不得引入第三方依赖"
    }
  ],
  "mission_id": "msn_eval_11_001",
  "non_goals": [
    "不修改其他基准函数",
    "不修改公开测试",
    "不引入第三方依赖"
  ],
  "object_id": "mc_eval_11",
  "overall_acceptance": [
    "OUT-001",
    "INV-001"
  ],
  "revision": 1,
  "risk_boundaries": [
    {
      "pattern": "图必须是 str 到唯一 str 列表的映射；稳定性以输入节点与依赖顺序为准。",
      "review_level": "terra-then-sol"
    }
  ],
  "schema": "token-firewall/mission-contract@0.1",
  "sol_token_budget": {
    "escalation_requires_reason": true,
    "planning_max": 12000,
    "review_max": 90000
  },
  "success_outcomes": [
    {
      "evidence": "公开测试、独立验证、匿名终审与延后隐藏测试通过",
      "id": "OUT-001",
      "statement": "实现 topological_order：依赖先于使用者、无依赖平局遵循输入顺序，并检测 cycle、缺失节点和畸形依赖列表。"
    }
  ]
}
