{
  "approval_boundaries": {
    "destructive_actions": false,
    "external_writes": false,
    "scope_expansion": false
  },
  "content_sha256": "c9bc49c9fa1352bae216e9734673e6d8b2b28c6f9a7fbbc7e4227d8f8b53fdc8",
  "created_at": "2026-07-12T15:00:00+08:00",
  "created_by": {
    "model": "gpt-5.6-sol",
    "role": "mission-architect",
    "runtime": "codex",
    "session_id": "suite-design-frozen"
  },
  "goal": "原子地读取或填充带 TTL 的缓存。",
  "invariants": [
    {
      "id": "INV-001",
      "severity": "critical",
      "statement": "不得修改公开测试或任务范围外文件，且实现不得引入第三方依赖"
    }
  ],
  "mission_id": "msn_eval_12_001",
  "non_goals": [
    "不修改其他基准函数",
    "不修改公开测试",
    "不引入第三方依赖"
  ],
  "object_id": "mc_eval_12",
  "overall_acceptance": [
    "OUT-001",
    "INV-001"
  ],
  "revision": 1,
  "risk_boundaries": [
    {
      "pattern": "expires_at 等于 now 已过期；TTL 必须是非布尔正整数，写入是最后一步。",
      "review_level": "terra-then-sol"
    }
  ],
  "schema": "token-firewall/mission-contract@0.1",
  "sol_token_budget": {
    "escalation_requires_reason": true,
    "planning_max": 12000,
    "review_max": 90000
  },
  "success_outcomes": [
    {
      "evidence": "公开测试、独立验证、匿名终审与延后隐藏测试通过",
      "id": "OUT-001",
      "statement": "实现 read_through_cache：expires_at>now 才命中，过期时调用 loader，并仅在 loader 成功且 TTL 合法后提交缓存。"
    }
  ]
}
