{
  "approval_boundaries": {
    "destructive_actions": false,
    "external_writes": false,
    "scope_expansion": false
  },
  "content_sha256": "765d726663ee9df94d637aaa9abda0fa1f96657e4cc360082ec05b458e2d0ad7",
  "created_at": "2026-07-12T15:00:00+08:00",
  "created_by": {
    "model": "gpt-5.6-sol",
    "role": "mission-architect",
    "runtime": "codex",
    "session_id": "suite-design-frozen"
  },
  "goal": "阻止路径穿越和符号链接逃逸。",
  "invariants": [
    {
      "id": "INV-001",
      "severity": "critical",
      "statement": "不得修改公开测试或任务范围外文件，且实现不得引入第三方依赖"
    }
  ],
  "mission_id": "msn_eval_09_001",
  "non_goals": [
    "不修改其他基准函数",
    "不修改公开测试",
    "不引入第三方依赖"
  ],
  "object_id": "mc_eval_09",
  "overall_acceptance": [
    "OUT-001",
    "INV-001"
  ],
  "revision": 1,
  "risk_boundaries": [
    {
      "pattern": "使用路径组件的包含关系而非字符串前缀；base 必须是已存在目录。",
      "review_level": "sol-deep-review"
    }
  ],
  "schema": "token-firewall/mission-contract@0.1",
  "sol_token_budget": {
    "escalation_requires_reason": true,
    "planning_max": 12000,
    "review_max": 140000
  },
  "success_outcomes": [
    {
      "evidence": "公开测试、独立验证、匿名终审与延后隐藏测试通过",
      "id": "OUT-001",
      "statement": "加固 safe_join：仅接受非空相对路径，解析后必须仍在真实 base 目录内，并拒绝绝对路径、.. 与 symlink escape。"
    }
  ]
}
